,tweets
0,"You are my favorite hello,
And my hardest goodbye."
1,Giga Berlin darf eröffnen 
2," 

Come join the team!"
3,"Hopefully, it is now extremely obvious that Europe should restart dormant nuclear power stations and increase power output of existing ones. 

This is *critical* to national and international security."
4,Launch and catch tower at Starbase destacking Starship
5,So amazing that we decompress from a single cell to over 30 trillion cells
6,Celebrating our one millionth 4680 cell in January
7,Reasons to hate are remembered better than reasons to love
8,"An evolutionary asymmetry helpful to survival, but counterproductive when survival is not at stake"
9,You can now customize how your Tesla appears on the screen and app with the Car Colorizer
10,Starship to Mars simulation
11,This will be real in our lifetime
12,Over 250k Starlink user terminals
13,Destacking Starship
14,Exciting time in commercial spaceflight. Polaris Program will undertake a series of tech demo 
15, missions culminating in first flight of Starship. Thankful to team 
16,", Polaris Directors & my amazing crew "
17, 
18,", Anna Menon"
19,Support for 
20, never ends
21,"The duty of a leader is to serve their people, not for the people to serve them"
22,A fully and rapidly reusable launch vehicle is key to a future in which humanity is out exploring the stars
23,The launch tower at Starbase will help stack Starship and catch the Super Heavy rocket booster
24,Liftoff!
25,Denmark just ended Covid restrictions
26,Non-Tesla vehicles can now charge at select Superchargers in France and Norway via the Tesla app. Learn more at 
27,Halo Infinite campaign is good
28,"For reasons unknown, "
29, is unable to say the word “Tesla”
30,So many Hitlers!
31,Good thing I never tweet anything controversial
32,It is heartening to see the rise of individualist vs corporate media
33,So informative
34,Good thing I never tweet anything controversial
35,It is heartening to see the rise of individualist vs corporate media
36,So informative
37,Good thing I never tweet anything controversial
38,It is heartening to see the rise of individualist vs corporate media
39,So informative
40,Good thing I never tweet anything controversial
41,It is heartening to see the rise of individualist vs corporate media
42,So informative
43,Good thing I never tweet anything controversial
44,It is heartening to see the rise of individualist vs corporate media
45,So informative
46,Good thing I never tweet anything controversial
47,It is heartening to see the rise of individualist vs corporate media
48,So informative
49,Good thing I never tweet anything controversial
50,It is heartening to see the rise of individualist vs corporate media
51,So informative
